"id","user_id","first_name","last_name","email","phone","dob","program","previous_education","personal_statement","submitted_at"
1,1,"Michael","Yeboah","yebahmichael977@gmail.com","0597528733","2025-08-05","Arts","Okess","i would like to join","2025-08-26 19:39:31.897786"
2,2,"Andrew","Osei-Wusu","andrewOsei@gmail.com","0249976484","2003-07-09","Vocational","SDASS","i would like to recieve an application to your school","2025-08-26 19:45:32.341474"
3,3,"Michael","Yeboah","andrewOsei@gmail.com","0249976484","2025-08-01","Arts","jlkhllk","l;h;lnklnlk","2025-08-27 10:49:54.465467"
4,4,"Vera","Splendor","verasplendor194@gmail.com","05034920290","1999-02-24","Vocational","Yaa Asentewaa Girls","i wanted to come study with you because of the various courses you offer","2025-08-27 16:34:07.433304"
5,5,"Kate","Nyame","kateNyame@gmail.com","0253016744","2003-02-13","Vocational","Gyaman Secondary School","I am a very determined and hardworking individual","2025-08-27 16:52:39.323069"
6,6,"Blessing","Yeboah","BlessingYeb@gmail.com","0253016744","2009-06-24","STEM","Blessed Kids Foundation ","I would like to attain more knowledge in your school","2025-08-27 16:58:14.59851"
